{
  "spec": "aic/0.1",
  "manifest_version": "0.1.0",
  "generated_at": "2026-03-28T00:00:00.000Z",
  "framework": "vite",
  "notes": [
    "before"
  ],
  "app": {
    "name": "Demo App"
  },
  "capabilities": {
    "runtimeUiTree": true,
    "semanticActions": true,
    "workflows": true,
    "permissions": true,
    "events": true,
    "actionContracts": true,
    "entityModel": true,
    "executionModel": true,
    "recoveryModel": true
  },
  "endpoints": {
    "ui": "/.well-known/agent/ui",
    "actions": "/.well-known/agent/actions",
    "permissions": "/.well-known/agent-permissions.json",
    "workflows": "/.well-known/agent-workflows.json"
  }
}
